<?xml version="1.0" encoding="UTF-8"?>
<!DOCTYPE eSummaryResult PUBLIC "-//NLM//DTD eSummaryResult//EN" "http://www.ncbi.nlm.nih.gov/entrez/query/DTD/eSummaryDTD/eSummary_pcsubstance.dtd">
<eSummaryResult>
<DocumentSummarySet status="OK">
<DocumentSummary uid="127317050">
	<SID>127317050</SID>
	<SourceNameList>
		<string>826</string>
		<string>EPO</string>
		<string>SLING Consortium</string>
	</SourceNameList>
	<CurrentSourceName>SLING Consortium</CurrentSourceName>
	<SourceID>30497-EP2292088A1</SourceID>
	<SourceCategoryList>
		<string>Patents</string>
	</SourceCategoryList>
	<SourceReleaseDate>2011/12/03 00:00</SourceReleaseDate>
	<DepositDate>2011/12/03 00:00</DepositDate>
	<ModifyDate>2011/12/03 00:00</ModifyDate>
	<RegistryNumber></RegistryNumber>
	<DBUrl></DBUrl>
	<SBUrl></SBUrl>
	<SynonymList>
		<string>30497-EP2292088A1</string>
		<string>CAT</string>
	</SynonymList>
	<MeSHHeadingList>
	</MeSHHeadingList>
	<MeSHTermList>
	</MeSHTermList>
	<PharmActionList>
	</PharmActionList>
	<CommentList>
		<string>&lt;a href=&quot;http://worldwide.espacenet.com/publicationDetails/biblio?FT=D&amp;CC=EP&amp;NR=2292088A1&amp;KC=A1&quot;&gt;Mutant receptors and their use in a nuclear receptor-based inducible gene expression system&lt;/a&gt;</string>
		<string>Patent Number: EP2292088A1</string>
		<string>Publication Date: 2011-03-09</string>
		<string>Classifications: C07K14/435A3, A61K31/16, A61K31/47, C07D215/44, C07H21/04, C12N15/62</string>
		<string>Applicant(s): INTREXON CORP [US]</string>
		<string>Hits: Description</string>
	</CommentList>
	<IUPACName>6-chloro-2-N,4-N-diethyl-1,3,5-triazine-2,4-diamine</IUPACName>
	<CanonicalSmiles>CCNC1=NC(=NC(=N1)Cl)NCC</CanonicalSmiles>
	<IsomericSmiles>CCNC1=NC(=NC(=N1)Cl)NCC</IsomericSmiles>
	<RotatableBondCount>4</RotatableBondCount>
	<MolecularFormula>C7H12ClN5</MolecularFormula>
	<MolecularWeight>    201.656680</MolecularWeight>
	<TotalFormalCharge>0</TotalFormalCharge>
	<XLogP>2.200</XLogP>
	<HydrogenBondDonorCount>2</HydrogenBondDonorCount>
	<HydrogenBondAcceptorCount>5</HydrogenBondAcceptorCount>
	<Complexity>    131.000000</Complexity>
	<HeavyAtomCount>13</HeavyAtomCount>
	<AtomChiralCount>0</AtomChiralCount>
	<AtomChiralDefCount>0</AtomChiralDefCount>
	<AtomChiralUndefCount>0</AtomChiralUndefCount>
	<BondChiralCount>0</BondChiralCount>
	<BondChiralDefCount>0</BondChiralDefCount>
	<BondChiralUndefCount>0</BondChiralUndefCount>
	<IsotopeAtomCount>0</IsotopeAtomCount>
	<CovalentUnitCount>1</CovalentUnitCount>
	<TautomerCount>5</TautomerCount>
	<CompoundIDList>
		<int>5216</int>
	</CompoundIDList>
	<TPSA>62.7</TPSA>
	<AssaySourceNameList>
	</AssaySourceNameList>
	<MinAC></MinAC>
	<MaxAC></MaxAC>
	<MinTC></MinTC>
	<MaxTC></MaxTC>
	<ActiveAidCount>0</ActiveAidCount>
	<InactiveAidCount>0</InactiveAidCount>
	<TotalAidCount>0</TotalAidCount>
	<InChIKey>ODCWYMIRDDJXKW-UHFFFAOYSA-N</InChIKey>
	<ProbeAidCount>0</ProbeAidCount>
	<HoldUntilDate>1/01/01 00:00</HoldUntilDate>
</DocumentSummary>

</DocumentSummarySet>
</eSummaryResult>
